{
  "schema_version": "1.0.0",
  "approval_id": "APR-0003",
  "episode_id": "PD-2026-007-riley",
  "target_type": "publish",
  "target_id": "riley_final_v001_youtube_schedule_20260622_1200_jst",
  "target_revision": "v001",
  "decision": "approved",
  "requested_at": "2026-06-20T23:55:30+09:00",
  "requested_by": "owner",
  "decided_at": "2026-06-20T23:55:30+09:00",
  "decided_by": "owner",
  "notes": "Owner instructed Codex to resume the stopped video and finish it after conflict checking. This approval covers uploading the final Riley package as a private YouTube video, setting the selected thumbnail, and scheduling public release for the next open noon slot after Terry: 2026-06-22 12:00 JST. It does not authorize deleting/replacing existing public videos or changing locked script/claims.",
  "conditions": [
    "Upload only the exact final render H:/pd-media/episodes/PD-2026-007-riley/08_edit/riley_final_v001.mp4 with sha256:ca595294db079a42a408543a83a7aee79a34348ada70494071560e97bb2ee3fe.",
    "Use selected thumbnail H:/pd-media/episodes/PD-2026-007-riley/09_package/thumbnails/PD-2026-007-riley-thumb01.v001.png with sha256:b093023534c67d72a3468fc2fafa2a95d69fa53f899797b30e366a7a9bb5766f.",
    "Schedule public release for 2026-06-22T12:00:00+09:00 (2026-06-22T03:00:00Z).",
    "Use the checked YouTube title, description, tags, category, language, and synthetic-content disclosure metadata from youtube_meta.v001.json.",
    "Keep madeForKids=false and containsSyntheticMedia=true.",
    "Verify channel allowlist before upload.",
    "Do not upload a duplicate if any Riley YouTube schedule result already exists."
  ],
  "expires_at": "2026-06-22T12:00:00+09:00",
  "evidence_snapshot_ref": "artifact://episodes/PD-2026-007-riley/09_package/youtube_meta.v001.json"
}
